OBJECTID,Name,Area_Code,Work_ID,zone_code,Gov,Address,Shape_Leng,حالة الحصر,المباني المنجزة,إجمالي المباني,عدد الوحدات,نسبة الإنجاز %,عدد الفرق,عدد المهندسين,آخر تحديث بواسطة,Shape_Length,Shape_Area
218,الوسطى--النصيرات-أرض المفتي,MNU0002,INDAS_M001,FMNU0002_E003,الوسطى,منطقة مربع المفتي والمخيم الجديد وارض ابو مهادي,1671.39923837,قيد الحصر,242.0,356.0,524,68.0,1.0,2.0,فاطمة جبر,1671.3992383736065,113538.85035228812
219,غزة-المغراقة,GZA0004,INDAS_G048,FGZA0004_E016,غزة, ,4146.73166396,مناطق حصر جديدة,,256.0,139,,,,,4146.731663955647,812552.0279485553
220,غزة-المغراقة,GZA0004,INDAS_G048,FGZA0004_E017,غزة, ,4208.98462504,مناطق حصر جديدة,,364.0,305,,,,,4208.984625038507,867624.69315083
221,غزة-المغراقة,GZA0004,INDAS_G048,FGZA0004_E018,غزة, ,3495.85170825,مناطق حصر جديدة,,392.0,399,,,,,3495.851708248389,614421.7180732512
222,غزة-المغراقة,GZA0004,INDAS_G048,FGZA0004_E019,غزة, ,4922.35099398,مناطق حصر جديدة,,329.0,424,,,,,4922.350993979802,757234.3172726118
223,الوسطى-دير البلح-مربع المشاعلة الغربي ومربع صالة سونستا للأفراح,MDB0003,INDAS_M010,FMDB0003_E009,الوسطى, ,3429.57387826,مناطق حصر جديدة,74.0,195.0,160,,,,,3429.5738782648455,690718.6138923608
224,الوسطى-دير البلح-مربع المشاعلة الشرقي ومربع مسجد البركة,MDB0003,INDAS_M011,FMDB0003_E010,الوسطى, ,3665.42221302,مناطق حصر جديدة,131.0,291.0,300,,,,,3665.4222130198846,609436.8659277199
225,الوسطى-دير البلح-مربع مسجد الأبرار,MDB0003,INDAS_M012,FMDB0003_E011,الوسطى, ,3712.81502579,مناطق حصر جديدة,,506.0,395,,,,,3712.815025790046,774526.7849403449
226,الوسطى-دير البلح-مربع أم ظهير ومسجد الرياطي,MDB0003,INDAS_M015,FMDB0003_E012,الوسطى, ,4533.35231891,مناطق حصر جديدة,95.0,369.0,291,,,,,4533.352318914066,1152279.8361070005
227,دير البلح-قصر أبو سليم,MDB0003,INDAS_M013,FMDB0003_E002,الوسطى,من شارع الحكر من جامع الفرقان الى ابو هولي,3111.58590985,تم الانتهاء,252.0,275.0,228,92.0,,,فاطمة جبر,3111.585909852342,413786.2159974037
228,الوسطى-دير البلح-مربع بوبع أرض القدرة وأبو هولي (الجعفراوي الغربي),MDB0003,INDAS_M014,FMDB0003_E013,الوسطى, ,3622.19015303,مناطق حصر جديدة,,410.0,315,,,,,3622.190153032477,748028.4494067552
229,الوسطى-وادي السلقا-مربع الجعفراوي ومربع حارة السعايدة والشرطة,MDB0003,INDAS_M016,FMDB0003_E014,الوسطى, ,4241.87235786,مناطق حصر جديدة,,366.0,212,,,,,4241.8723578559775,839008.2499826348
230,خانيونس-مربع أبراج الفرا والمنطقة المقابر,KKY0006,INDAS_K024,FKKY0006_E016,خانيونس, ,3143.22732176,مناطق حصر جديدة,,370.0,577,,,,,3143.22732175518,281335.0822732699
231,خانيونس-المعسكر-مربع كراج رفح البطن السمين ومربع صالة روان للأفراح,KKY0006,INDAS_K022,FKKY0006_E017,خانيونس, ,1801.41166489,قيد الحصر,,353.0,852,,1.0,2.0,أفنان  أبو جزر,1801.4116648876247,127965.34814086856
232,خانيونس-البلد,KKY0006,INDAS_K002,FKKY0006_E007,خانيونس,حانيونس البلد المنطقة الواقعة جنوب شارع البحر وشرق منتزة البلدية,1304.59246451,مناطق حصر جديدة,,,509,,,,,1304.5924645061152,83276.935909068
233,خانيونس-البلد,KKY0006,INDAS_K002,FKKY0006_E006,خانيونس,حانيونس البلد المنطقة الواقعة جنوب شارع البحر وشرق منتزة البلدية,1182.54544739,قيد الحصر,95.0,169.0,488,56.0,,,,1182.545447391109,74859.79016291849
234,خانيونس-البلد,KKY0006,INDAS_K002,FKKY0006_E005,خانيونس,حانيونس البلد المنطقة الواقعة جنوب شارع البحر وشرق منتزة البلدية,1109.64294611,قيد الحصر,,,415,,1.0,2.0,أفنان  أبو جزر,1109.6429461124883,63927.19264244917
235,خانيونس-مربع مركز المدينة 2 ومربع حارة الشاعر ومدرسة عبد الرحمن الأغا,KKY0004,INDAS_K023,FKKY0004_E003,خانيونس, ,2378.23877666,مناطق حصر جديدة,,,1073,,,,,2378.2387766551024,242881.37647693386
236,خانيونس-مربع مركز المدينة 1,KKY0004,INDAS_K020,FKKY0004_E004,خانيونس, ,1531.26227646,مناطق حصر جديدة,,210.0,600,,,,,1531.262276457634,111592.77376137307
237,خانيونس-المنطقة الواقعة بين مربع حارة المجايدة وحسني ومربع السيقلي والقسام,KKY0006,INDAS_K019,FKKY0006_E018,خانيونس, ,1484.15173798,مناطق حصر جديدة,,,521,,,,,1484.1517379846773,128248.49493438292
238,خانيونس-مربع شارع الترنس ومربع شارع القدرة,KKY0006,INDAS_K016,FKKY0006_E019,خانيونس, ,1217.89595535,مناطق حصر جديدة,,126.0,459,,,,,1217.8959553464135,63281.051093737406
239,خانيونس-المعسكر-مربع عيادة وكالة الظهرة ومربع بركة,KKY0007,INDAS_K017,FKKY0007_E008,خانيونس, ,1336.61860095,مناطق حصر جديدة,,329.0,623,,,,,1336.618600946408,109202.13802578815
240,خانيونس-المعسكر-مربع عيادة وكالة الظهرة ومربع بركة,KKY0007,INDAS_K017,FKKY0007_E009,خانيونس, ,1186.67447985,مناطق حصر جديدة,,162.0,604,,,,,1186.6744798514458,77718.42749000601
241,خانيونس-مربع مستشفى ناصر وأبراج النمساوي ومربع حارة المجادلة,KKY0007,INDAS_K021,FKKY0007_E010,خانيونس, ,2522.47485345,مناطق حصر جديدة,,,579,,,,,2522.47485344667,264744.19974224264
242,خانيونس-المعسكر-مربع الهلال الأحمر ومربع المدارس,KKY0006,INDAS_K018,FKKY0006_E020,خانيونس, ,2239.29140957,مناطق حصر جديدة,,,1268,,,,,2239.2914095707624,204813.2019036291
243,خانيونس-مربع مسجد أبو بكر الصديق,KKY0006,INDAS_K012,FKKY0006_E021,خانيونس, ,2234.69699962,مناطق حصر جديدة,,373.0,846,,,,,2234.6969996200805,288017.7165397841
244,خانيونس-مربع المحطة,KBS0002,INDAS_K014,FKBS0002_E003,خانيونس, ,2136.05866622,مناطق حصر جديدة,,299.0,548,,,,,2136.0586662166425,257142.02629180407
245,خانيونس-مربع المحطة,KBS0002,INDAS_K014,FKBS0002_E004,خانيونس, ,1923.99338069,مناطق حصر جديدة,,248.0,285,,,,,1923.9933806879199,166232.03738422395
246,خانيونس-المنطقة الواقعة بين كلية تدريب خانيونس والحي الياباني وحس البراق والاماراتي2,KKY0007,INDAS_K009,FKKY0007_E011,خانيونس, ,2609.69513467,مناطق حصر جديدة,,,242,,,,,2609.6951346677824,305237.86868853815
247,خانيونس-مربع المشروع الهولندي والاماراتي1,KKY0007,INDAS_K010,FKKY0007_E012,خانيونس, ,1450.52438269,مناطق حصر جديدة,,164.0,261,,,,,1450.5243826949088,105216.58016911289
248,خانيونس-حي الأمل,KKY0006,INDAS_K001,FKKY0006_E001,خانيونس,منطقة العرايشية-جنوب بركة المشروع  وفي الشرق من الاتحدا النسائي الى مسجد حسن البنا,1562.39084898,تم الانتهاء,180.0,184.0,362,98.0,,,أفنان  أبو جزر,1562.3908489792814,89708.0503272411
249,خانيونس-حي الأمل,KKY0006,INDAS_K001,FKKY0006_E002,خانيونس,منطقة العرايشية-جنوب بركة المشروع  وفي الشرق من الاتحدا النسائي الى مسجد حسن البنا,1071.56452094,قيد الحصر,,,370,,1.0,,أفنان  أبو جزر,1071.56452093702,64641.071535689305
250,خانيونس-مربع بركة حي الأمل والعرايشية مربع مسجد حسن البنا,KKY0006,INDAS_K011,FKKY0006_E022,خانيونس, ,1278.78027011,مناطق حصر جديدة,,138.0,313,,,,,1278.7802701052185,87467.57933029176
251,خانيونس-مربع مسجد الكتيبة ومربع الربوات العربية,KBS0002,INDAS_K013,FKBS0002_E005,خانيونس, ,3437.63695658,مناطق حصر جديدة,,,625,,,,,3437.636956580618,408908.88381191314
252,خانيونس-مربع مدرسة عيد الأغا وصالة بانوراما ومربع مسجد العباسي,KQA0001,INDAS_K008,FKQA0001_E004,خانيونس, ,4104.41942584,مناطق حصر جديدة,,413.0,413,,,,,4104.419425838747,738468.6271310407
253,خانيونس-مربع مدرسة عيد الأغا وصالة بانوراما ومربع مسجد العباسي,KQA0001,INDAS_K008,FKQA0001_E005,خانيونس, ,3952.34244769,مناطق حصر جديدة,,375.0,383,,,,,3952.342447688473,729518.0771714981
254,خانيونس-مربع محطة الأغا ومربع محطة عودة,KQA0001,INDAS_K007,FKQA0001_E006,خانيونس, ,4992.62496704,مناطق حصر جديدة,,369.0,390,,,,,4992.624967040759,791720.7475433444
255,خانيونس-المواصي-مربع محطة الأسطل للبترول,KKY0007,INDAS_K004,FKKY0007_E013,خانيونس, ,4999.64631346,مناطق حصر جديدة,,318.0,198,,,,,4999.646313455987,1161951.8691020284
256,خانيونس-البركة,KKY0007,INDAS_K003,FKKY0007_E014,خانيونس, ,5036.58163241,مناطق حصر جديدة,,156.0,86,,,,,5036.58163241308,1131679.5569060806
257,خانيونس-مربع إسكان الياباني,KKY0007,INDAS_K005,FKKY0007_E015,خانيونس, ,6426.37111352,مناطق حصر جديدة,,36.0,14,,,,,6426.371113522686,1625124.8602114383
258,غزة-مربع مقبرة الشيخ رضوان وبرج الايطالي,GGA0009,INDAS_G053,FGGA0009_E016,غزة, ,1953.58966218,قيد الحصر,13.0,221.0,775,6.0,1.0,3.0,سامر وهبة,1953.589662184018,232457.65575487958
259,غزة-المنطقة التي تجمع بين مربع الجسر -عيادة وكالة الشيخ رضوان - مربع القسطل-مربع مسجد حطين,GGA0009,INDAS_G013,FGGA0009_E017,غزة, ,1097.46650072,قيد الحصر,38.0,162.0,681,23.0,1.0,3.0,سامر وهبة,1097.466500718601,68581.07572713133
260,غزة-مربع عبدالله عزام وبيارة الدهشان,GGA0006,INDAS_G035,FGGA0006_E022,غزة, ,1404.01764406,مناطق حصر جديدة,,254.0,923,,,,,1404.0176440625391,97217.08508973487
261,غزة-مربع مسجد الكنز,GGA0008,INDAS_G025,FGGA0008_E024,غزة, ,1792.59881528,مناطق حصر جديدة,0.0,148.0,575,,,,,1792.5988152832,175253.37933810495
262,الوسطى-النصيرات-مخيم النصيرات,MNU0002,INDAS_M005,FMNU0002_E026,الوسطى, ,1667.7375492,قيد الحصر,67.0,246.0,550,27.0,1.0,,فاطمة جبر,1667.7375491976477,98571.09480765839
263,الوسطى-النصيرات-مربع أراضي (مطر والحرثاني وأبو عريبان),MNU0002,INDAS_M006,FMNU0002_E027,الوسطى, ,1313.42033326,مناطق حصر جديدة,62.0,128.0,509,,,,,1313.4203332619707,105088.07420254969
264,خانيونس-مربع مدينة حمد,KQA0001,INDAS_K006,FKQA0001_E007,خانيونس, ,1946.69281882,مناطق حصر جديدة,,,129,,,,,1946.6928188170755,162580.13623716414
